synbols-arefruqaa, Aref Ruqaa Regular, OFL, Abdullah Aref  Khaled Hosny  Hermann Zapf, Portions copyright  2015  Khaled Hosny (<khaledhosny@eglug.org>). Portions copyright  1997  2009  2011 American Mathematical Society (<http://www.ams.org>)  with Reserved Font Name EURM10.
synbols-arefruqaa, Aref Ruqaa Bold, OFL, Abdullah Aref  Khaled Hosny  Hermann Zapf, Portions copyright  2015  Khaled Hosny (<khaledhosny@eglug.org>). Portions copyright  1997  2009  2011 American Mathematical Society (<http://www.ams.org>)  with Reserved Font Name EURB10.
synbols-blinkerthin, Blinker Thin, OFL, Juergen Huber, Copyright 2019 the Blinker project authors (https://github.com/supertype-de/Blinker)
synbols-blinkerextralight, Blinker ExtraLight, OFL, Juergen Huber, Copyright 2019 the Blinker project authors (https://github.com/supertype-de/Blinker)
synbols-blinkerlight, Blinker Light, OFL, Juergen Huber, Copyright 2019 the Blinker project authors (https://github.com/supertype-de/Blinker)
synbols-blinker, Blinker, OFL, Juergen Huber, Copyright 2019 the Blinker project authors (https://github.com/supertype-de/Blinker)
synbols-blinkersemibold, Blinker SemiBold, OFL, Juergen Huber, Copyright 2019 the Blinker project authors (https://github.com/supertype-de/Blinker)
synbols-blinker, Blinker Bold, OFL, Juergen Huber, Copyright 2019 the Blinker project authors (https://github.com/supertype-de/Blinker)
synbols-blinkerextrabold, Blinker ExtraBold, OFL, Juergen Huber, Copyright 2019 the Blinker project authors (https://github.com/supertype-de/Blinker)
synbols-blinkerblack, Blinker Black, OFL, Juergen Huber, Copyright 2019 the Blinker project authors (https://github.com/supertype-de/Blinker)
synbols-frederickathegreat, Fredericka the Great, OFL, Tart Workshop, Copyright (c) 2011 by Font Diner  Inc DBA Tart Workshop (diner@fontdiner.com) with Reseved Font Name Fredericka the Great
synbols-sarina, Sarina, OFL, James Grieshaber, Copyright (c) 2011  Sorkin Type Co (www.sorkintype.com eben@eyebytes.com) with Reserved Font Name Sarina.
synbols-belleza, Belleza Regular, OFL, Eduardo Tunni, Copyright (c) 2012  Eduardo Tunni (http://www.tipo.net.ar)  with Reserved Font Name Belleza
synbols-sen, Sen Regular, OFL, Kosal Sen, Copyright 2015 The Sen Project Authors (https://github.com/philatype/Sen)
synbols-sen, Sen Bold, OFL, Kosal Sen, Copyright 2015 The Sen Project Authors (https://github.com/philatype/Sen)
synbols-senextrabold, Sen ExtraBold, OFL, Kosal Sen, Copyright 2015 The Sen Project Authors (https://github.com/philatype/Sen)
synbols-italiana, Italiana, OFL, Santiago Orozco, Copyright (c) 2011 by Santiago Orozco (hi@typemade.mx) with reserved name Italiana
synbols-balootammudu, Baloo Tammudu Regular, OFL, Ek Type, Copyright (c) 2015 Ek Type (www.ektype.in)
synbols-baloopaaji2, Baloo Paaji 2 Regular, OFL, Ek Type, Copyright 2019 The Baloo 2 Project Authors (https://github.com/EkType/Baloo2)
synbols-baloopaaji2medium, Baloo Paaji 2 Medium, OFL, Ek Type, Copyright 2019 The Baloo 2 Project Authors (https://github.com/EkType/Baloo2)
synbols-baloopaaji2semibold, Baloo Paaji 2 SemiBold, OFL, Ek Type, Copyright 2019 The Baloo 2 Project Authors (https://github.com/EkType/Baloo2)
synbols-baloopaaji2, Baloo Paaji 2 Bold, OFL, Ek Type, Copyright 2019 The Baloo 2 Project Authors (https://github.com/EkType/Baloo2)
synbols-baloopaaji2extrabold, Baloo Paaji 2 ExtraBold, OFL, Ek Type, Copyright 2019 The Baloo 2 Project Authors (https://github.com/EkType/Baloo2)
synbols-prozalibre, Proza Libre Regular, OFL, Jasper de Waard, Copyright (c) 2015 by Jasper de Waard. All rights reserved.
synbols-prozalibre, Proza Libre Italic, OFL, Jasper de Waard, Copyright (c) 2015 by Jasper de Waard. All rights reserved.
synbols-prozalibremedium, Proza Libre Medium, OFL, Jasper de Waard, Copyright (c) 2015 by Jasper de Waard. All rights reserved.
synbols-prozalibremedium, Proza Libre Medium Italic, OFL, Jasper de Waard, Copyright (c) 2015 by Jasper de Waard. All rights reserved.
synbols-prozalibresemibold, Proza Libre SemiBold, OFL, Jasper de Waard, Copyright (c) 2015 by Jasper de Waard. All rights reserved.
synbols-prozalibresemibold, Proza Libre SemiBold Italic, OFL, Jasper de Waard, Copyright (c) 2015 by Jasper de Waard. All rights reserved.
synbols-prozalibre, Proza Libre Bold, OFL, Jasper de Waard, Copyright (c) 2015 by Jasper de Waard. All rights reserved.
synbols-prozalibre, Proza Libre Bold Italic, OFL, Jasper de Waard, Copyright (c) 2015 by Jasper de Waard. All rights reserved.
synbols-prozalibreextrabold, Proza Libre ExtraBold, OFL, Jasper de Waard, Copyright (c) 2013 by Jasper de Waard. All rights reserved.
synbols-prozalibreextrabold, Proza Libre ExtraBold Italic, OFL, Jasper de Waard, Copyright (c) 2013 by Jasper de Waard. All rights reserved.
synbols-diplomatasc, Diplomata SC, OFL, Eduardo Tunni, Copyright (c) 2011  Eduardo Tunni (http://www.tipo.net.ar edu@tipo.net.ar)  with Reserved Font Name Diplomata
synbols-badscript, Bad Script Regular, OFL, Gaslight, Copyright 2011 The Bad Script Project Authors (gaslighttypefoundry@gmail.com)
synbols-cormorantsclight, Cormorant SC Light, OFL, Christian Thalmann, Copyright 2015 The Cormorant Project Authors (github.com/CatharsisFonts/Cormorant)
synbols-cormorantsc, Cormorant SC Regular, OFL, Christian Thalmann, Copyright 2015 The Cormorant Project Authors (github.com/CatharsisFonts/Cormorant)
synbols-cormorantscmedium, Cormorant SC Medium, OFL, Christian Thalmann, Copyright 2015 The Cormorant Project Authors (github.com/CatharsisFonts/Cormorant)
synbols-cormorantscsemibold, Cormorant SC SemiBold, OFL, Christian Thalmann, Copyright 2015 The Cormorant Project Authors (github.com/CatharsisFonts/Cormorant)
synbols-cormorantsc, Cormorant SC Bold, OFL, Christian Thalmann, Copyright 2015 The Cormorant Project Authors (github.com/CatharsisFonts/Cormorant)
synbols-julee, Julee-Regular, OFL, Julian Tunni, Copyright (c) 2011  Julian Tunni (jotadejulian@hotmail.com)  with Reserved Font Name Julee
synbols-hindmadurailight, Hind Madurai Light, OFL, Indian Type Foundry, Copyright (c) 2015 Indian Type Foundry (info@indiantypefoundry.com)
synbols-hindmadurai, Hind Madurai Regular, OFL, Indian Type Foundry, Copyright (c) 2015 Indian Type Foundry (info@indiantypefoundry.com)
synbols-hindmaduraimedium, Hind Madurai Medium, OFL, Indian Type Foundry, Copyright (c) 2015 Indian Type Foundry (info@indiantypefoundry.com)
synbols-hindmaduraisemibold, Hind Madurai SemiBold, OFL, Indian Type Foundry, Copyright (c) 2015 Indian Type Foundry (info@indiantypefoundry.com)
synbols-hindmadurai, Hind Madurai Bold, OFL, Indian Type Foundry, Copyright (c) 2015 Indian Type Foundry (info@indiantypefoundry.com)
synbols-patrickhandsc, Patrick Hand SC Regular, OFL, Patrick Wagesreiter, Copyright 2012 The Patrick Hand Authors (mail@patrickwagesreiter.at)
synbols-yinmar, Yinmar, OFL, Danh Hong, Copyright 2014 Google Inc. All Rights Reserved.
synbols-ropasans, Ropa Sans Regular, OFL, Botjo Nikoltchev, Copyright 2013 The Ropa Sans Project Authors (nikoltchev@lettersoup.de)  with Reserved Font Name Ropa Sans.
synbols-ropasans, Ropa Sans Italic, OFL, Botjo Nikoltchev, Copyright 2013 The Ropa Sans Project Authors (nikoltchev@lettersoup.de)  with Reserved Font Name Ropa Sans.
synbols-fjallaone, Fjalla One, OFL, Sorkin Type, Copyright (c) 2011 by Sorkin Type Co (www.sorkintype.com eben@eyebytes.com)  with Reserved Font Name 'Fjalla'
synbols-gabriela, Gabriela Regular, OFL, Eduardo Tunni, Copyright 2013 The Gabriela Project Authors (edu@tipo.net.ar)  with Reserved Font Name Gabriela.
synbols-thegirlnextdoor, The Girl Next Door, OFL, Kimberly Geswein, Copyright (c) 2010  Kimberly Geswein (kimberlygeswein.com kimberlygeswein@gmail.com)
synbols-anticdidone, Antic Didone Regular, OFL, Santiago Orozco, Copyright (c) 2011  Santiago Orozco (hi@typemade.mx)  with Reserved Font Name Antic Didone.
synbols-marmelad, Marmelad Regular, OFL, Cyreal, Copyright 2016 The Marmelad Project Authors (manveltype@gmail.com)  with Reserved Font Name Marmelad.
synbols-k2dthin, K2D Thin, OFL, Cadson Demak, Copyright 2018 The K2D Project Authors (https://github.com/cadsondemak/K2D)
synbols-k2dthin, K2D Thin Italic, OFL, Cadson Demak, Copyright 2018 The K2D Project Authors (https://github.com/cadsondemak/K2D)
synbols-k2dextralight, K2D ExtraLight, OFL, Cadson Demak, Copyright 2018 The K2D Project Authors (https://github.com/cadsondemak/K2D)
synbols-k2dextralight, K2D ExtraLight Italic, OFL, Cadson Demak, Copyright 2018 The K2D Project Authors (https://github.com/cadsondemak/K2D)
synbols-k2dlight, K2D Light, OFL, Cadson Demak, Copyright 2018 The K2D Project Authors (https://github.com/cadsondemak/K2D)
synbols-k2dlight, K2D Light Italic, OFL, Cadson Demak, Copyright 2018 The K2D Project Authors (https://github.com/cadsondemak/K2D)
synbols-k2d, K2D Regular, OFL, Cadson Demak, Copyright 2018 The K2D Project Authors (https://github.com/cadsondemak/K2D)
synbols-k2d, K2D Italic, OFL, Cadson Demak, Copyright 2018 The K2D Project Authors (https://github.com/cadsondemak/K2D)
synbols-k2dmedium, K2D Medium, OFL, Cadson Demak, Copyright 2018 The K2D Project Authors (https://github.com/cadsondemak/K2D)
synbols-k2dmedium, K2D Medium Italic, OFL, Cadson Demak, Copyright 2018 The K2D Project Authors (https://github.com/cadsondemak/K2D)
synbols-k2dsemibold, K2D SemiBold, OFL, Cadson Demak, Copyright 2018 The K2D Project Authors (https://github.com/cadsondemak/K2D)
synbols-k2dsemibold, K2D SemiBold Italic, OFL, Cadson Demak, Copyright 2018 The K2D Project Authors (https://github.com/cadsondemak/K2D)
synbols-k2d, K2D Bold, OFL, Cadson Demak, Copyright 2018 The K2D Project Authors (https://github.com/cadsondemak/K2D)
synbols-k2d, K2D Bold Italic, OFL, Cadson Demak, Copyright 2018 The K2D Project Authors (https://github.com/cadsondemak/K2D)
synbols-k2dextrabold, K2D ExtraBold, OFL, Cadson Demak, Copyright 2018 The K2D Project Authors (https://github.com/cadsondemak/K2D)
synbols-k2dextrabold, K2D ExtraBold Italic, OFL, Cadson Demak, Copyright 2018 The K2D Project Authors (https://github.com/cadsondemak/K2D)
synbols-rye, Rye Regular, OFL, Nicole Fally, Copyright (c) 2012  Sorkin Type Co (eben@eyebytes.com) with Reserved Font Name 'Rye'
synbols-condiment, Condiment, OFL, Sudtipos, Copyright (c) 2010 Angel Koziupa (sudtipos@sudtipos.com)  Copyright (c) 2010 Alejandro Paul (sudtipos@sudtipos.com)  with Reserved Font Name Condiment
synbols-cormorantlight, Cormorant Light, OFL, Christian Thalmann, Copyright 2015 The Cormorant Project Authors (github.com/CatharsisFonts/Cormorant)
synbols-cormorantlight, Cormorant Light Italic, OFL, Christian Thalmann, Copyright 2015 The Cormorant Project Authors (github.com/CatharsisFonts/Cormorant)
synbols-cormorant, Cormorant Regular, OFL, Christian Thalmann, Copyright 2015 The Cormorant Project Authors (github.com/CatharsisFonts/Cormorant)
synbols-cormorant, Cormorant Italic, OFL, Christian Thalmann, Copyright 2015 The Cormorant Project Authors (github.com/CatharsisFonts/Cormorant)
synbols-cormorantmedium, Cormorant Medium, OFL, Christian Thalmann, Copyright 2015 The Cormorant Project Authors (github.com/CatharsisFonts/Cormorant)
synbols-cormorantmedium, Cormorant Medium Italic, OFL, Christian Thalmann, Copyright 2015 The Cormorant Project Authors (github.com/CatharsisFonts/Cormorant)
synbols-cormorantsemibold, Cormorant SemiBold, OFL, Christian Thalmann, Copyright 2015 The Cormorant Project Authors (github.com/CatharsisFonts/Cormorant)
synbols-cormorantsemibold, Cormorant SemiBold Italic, OFL, Christian Thalmann, Copyright 2015 The Cormorant Project Authors (github.com/CatharsisFonts/Cormorant)
synbols-cormorant, Cormorant Bold, OFL, Christian Thalmann, Copyright 2015 The Cormorant Project Authors (github.com/CatharsisFonts/Cormorant)
synbols-cormorant, Cormorant Bold Italic, OFL, Christian Thalmann, Copyright 2015 The Cormorant Project Authors (github.com/CatharsisFonts/Cormorant)
synbols-lexenddeca, Lexend Deca Regular, OFL, Thomas Jockin, Copyright 2019 The Lexend Project Authors (https://github.com/ThomasJockin/lexend)
synbols-cevicheone, Ceviche One, OFL, Miguel Hernandez, Copyright (c) 2011 by LatinoType Limitada (luciano@latinotype.com)  with Reserved Font Names Cecivhe and Ceviche One
synbols-miama, Miama, OFL, Linus Romer, Copyright (c) 2008-2011  Linus Romer  with Reserved Font Name Miama. This Font Software is licensed under the SIL Open Font License  Version 1.1.
synbols-mogra, Mogra Regular, OFL, Lipi Raval, Copyright (c) 2015 Lipi Raval (raval.lipi@gmail.com)
synbols-artifika, Artifika Regular, OFL, Cyreal, Copyright (c) 2011 by Yulya Zhdanova | Cyreal. All rights reserved.
synbols-monda, Monda Regular, OFL, Vernon Adams, Copyright (c) 2012  vernon adams (vern@newtypography.co.uk)  with Reserved Font Names 'Monda'
synbols-monda, Monda Bold, OFL, Vernon Adams, Copyright (c) 2012  vernon adams (vern@newtypography.co.uk)  with Reserved Font Names 'Monda'
synbols-notoserif, Noto Serif, OFL, Google, Copyright 2012 Google Inc. All Rights Reserved.
synbols-notoserif, Noto Serif Italic, OFL, Google, Copyright 2012 Google Inc. All Rights Reserved.
synbols-notoserif, Noto Serif Bold, OFL, Google, Copyright 2012 Google Inc. All Rights Reserved.
synbols-notoserif, Noto Serif Bold Italic, OFL, Google, Copyright 2012 Google Inc. All Rights Reserved.
synbols-lexendgiga, Lexend Giga Regular, OFL, Thomas Jockin, Copyright 2019 The Lexend Project Authors (https://github.com/ThomasJockin/lexend)
synbols-lilitaone, Lilita One, OFL, Juan Montoreano, Copyright (c) 2011 Juan Montoreano (juan@remolacha.biz)  with Reserved Font Names Lilita One
synbols-kameron, Kameron, OFL, Vernon Adams, Copyright (c) 2011  Vernon Adams (vern@newtypography.co.uk) with Reserved Font Name 'Kameron'. All rights reserved.
synbols-kameron, Kameron Bold, OFL, Vernon Adams, Copyright (c) 2011  Vernon Adams (vern@newtypography.co.uk) with Reserved Font Name 'Kameron'. All rights reserved.
synbols-stalinone, Stalin One, OFL, Multiple Designers, Copyright (c) 2009-2011  Alexey Maslov  Jovanny Lemonad (lemonad@jovanny.ru)  with Reserved Font Name 'Stalin'
synbols-bigshoulderstextthin, Big Shoulders Text Thin, OFL, Patric King, Copyright 2019 The Big Shoulders Project Authors (https://github.com/xotypeco/big_shoulders)
synbols-bigshoulderstextlight, Big Shoulders Text Light, OFL, Patric King, Copyright 2019 The Big Shoulders Project Authors (https://github.com/xotypeco/big_shoulders)
synbols-bigshoulderstext, Big Shoulders Text Regular, OFL, Patric King, Copyright 2019 The Big Shoulders Project Authors (https://github.com/xotypeco/big_shoulders)
synbols-bigshoulderstextmedium, Big Shoulders Text Medium, OFL, Patric King, Copyright 2019 The Big Shoulders Project Authors (https://github.com/xotypeco/big_shoulders)
synbols-bigshoulderstextsemibold, Big Shoulders Text SemiBold, OFL, Patric King, Copyright 2019 The Big Shoulders Project Authors (https://github.com/xotypeco/big_shoulders)
synbols-bigshoulderstext, Big Shoulders Text Bold, OFL, Patric King, Copyright 2019 The Big Shoulders Project Authors (https://github.com/xotypeco/big_shoulders)
synbols-bigshoulderstextextrabold, Big Shoulders Text ExtraBold, OFL, Patric King, Copyright 2019 The Big Shoulders Project Authors (https://github.com/xotypeco/big_shoulders)
synbols-bigshoulderstextblack, Big Shoulders Text Black, OFL, Patric King, Copyright 2019 The Big Shoulders Project Authors (https://github.com/xotypeco/big_shoulders)
synbols-miltoniantattoo, Miltonian Tattoo, OFL, Impallari Type, Copyright (c) 2011 by Pablo Impallari (www.impallari.com impallari@gmail.com). Igino Marini (www.ikern.com)
synbols-labelleaurore, La Belle Aurore, OFL, Kimberly Geswein, Copyright (c) 2010  Kimberly Geswein (kimberlygeswein.com kimberlygeswein@gmail.com)
synbols-headlandone, Headland One, OFL, Gary Lonergan, Copyright (c) 2011-2012  Sorkin Type Co (www.sorkintype.com eben@eyebytes.com)  with Reserved Font Name Headland
synbols-delius, Delius-Regular, OFL, Natalia Raices, Copyright (c) 2010 by Natalia Raices (nraices@gmail.com). All rights reserved.
synbols-viga, Viga-Regular, OFL, Fontstage, Copyright (c) 2011 Fontstage (info@fontstage.com)  with Reserved Font Name Viga
synbols-montserratalternatesthin, Montserrat Alternates Thin, OFL, Julieta Ulanovsky  Sol Matas  Juan Pablo del Peral  Jacques Le Bailly, Copyright 2011 The Montserrat Project Authors (https://github.com/JulietaUla/Montserrat)
synbols-montserratalternatesthin, Montserrat Alternates Thin Italic, OFL, Julieta Ulanovsky  Sol Matas  Juan Pablo del Peral  Jacques Le Bailly, Copyright 2011 The Montserrat Project Authors (https://github.com/JulietaUla/Montserrat)
synbols-montserratalternatesexlight, Montserrat Alternates ExtraLight, OFL, Julieta Ulanovsky  Sol Matas  Juan Pablo del Peral  Jacques Le Bailly, Copyright 2011 The Montserrat Project Authors (https://github.com/JulietaUla/Montserrat)
synbols-montserratalternatesexlight, Montserrat Alternates ExtraLight Italic, OFL, Julieta Ulanovsky  Sol Matas  Juan Pablo del Peral  Jacques Le Bailly, Copyright 2011 The Montserrat Project Authors (https://github.com/JulietaUla/Montserrat)
synbols-montserratalternateslight, Montserrat Alternates Light, OFL, Julieta Ulanovsky  Sol Matas  Juan Pablo del Peral  Jacques Le Bailly, Copyright 2011 The Montserrat Project Authors (https://github.com/JulietaUla/Montserrat)
synbols-montserratalternateslight, Montserrat Alternates Light Italic, OFL, Julieta Ulanovsky  Sol Matas  Juan Pablo del Peral  Jacques Le Bailly, Copyright 2011 The Montserrat Project Authors (https://github.com/JulietaUla/Montserrat)
synbols-montserratalternates, Montserrat Alternates Regular, OFL, Julieta Ulanovsky  Sol Matas  Juan Pablo del Peral  Jacques Le Bailly, Copyright 2011 The Montserrat Project Authors (https://github.com/JulietaUla/Montserrat)
synbols-montserratalternates, Montserrat Alternates Italic, OFL, Julieta Ulanovsky  Sol Matas  Juan Pablo del Peral  Jacques Le Bailly, Copyright 2011 The Montserrat Project Authors (https://github.com/JulietaUla/Montserrat)
synbols-montserratalternatesmedium, Montserrat Alternates Medium, OFL, Julieta Ulanovsky  Sol Matas  Juan Pablo del Peral  Jacques Le Bailly, Copyright 2011 The Montserrat Project Authors (https://github.com/JulietaUla/Montserrat)
synbols-montserratalternatesmedium, Montserrat Alternates Medium Italic, OFL, Julieta Ulanovsky  Sol Matas  Juan Pablo del Peral  Jacques Le Bailly, Copyright 2011 The Montserrat Project Authors (https://github.com/JulietaUla/Montserrat)
synbols-montserratalternatessemibold, Montserrat Alternates SemiBold, OFL, Julieta Ulanovsky  Sol Matas  Juan Pablo del Peral  Jacques Le Bailly, Copyright 2011 The Montserrat Project Authors (https://github.com/JulietaUla/Montserrat)
synbols-montserratalternatessemibold, Montserrat Alternates SemiBold Italic, OFL, Julieta Ulanovsky  Sol Matas  Juan Pablo del Peral  Jacques Le Bailly, Copyright 2011 The Montserrat Project Authors (https://github.com/JulietaUla/Montserrat)
synbols-montserratalternates, Montserrat Alternates Bold, OFL, Julieta Ulanovsky  Sol Matas  Juan Pablo del Peral  Jacques Le Bailly, Copyright 2011 The Montserrat Project Authors (https://github.com/JulietaUla/Montserrat)
synbols-montserratalternates, Montserrat Alternates Bold Italic, OFL, Julieta Ulanovsky  Sol Matas  Juan Pablo del Peral  Jacques Le Bailly, Copyright 2011 The Montserrat Project Authors (https://github.com/JulietaUla/Montserrat)
synbols-montserratalternatesextrabold, Montserrat Alternates ExtraBold, OFL, Julieta Ulanovsky  Sol Matas  Juan Pablo del Peral  Jacques Le Bailly, Copyright 2011 The Montserrat Project Authors (https://github.com/JulietaUla/Montserrat)
synbols-montserratalternatesextrabold, Montserrat Alternates ExtraBold Italic, OFL, Julieta Ulanovsky  Sol Matas  Juan Pablo del Peral  Jacques Le Bailly, Copyright 2011 The Montserrat Project Authors (https://github.com/JulietaUla/Montserrat)
synbols-montserratalternatesblack, Montserrat Alternates Black, OFL, Julieta Ulanovsky  Sol Matas  Juan Pablo del Peral  Jacques Le Bailly, Copyright 2011 The Montserrat Project Authors (https://github.com/JulietaUla/Montserrat)
synbols-montserratalternatesblack, Montserrat Alternates Black Italic, OFL, Julieta Ulanovsky  Sol Matas  Juan Pablo del Peral  Jacques Le Bailly, Copyright 2011 The Montserrat Project Authors (https://github.com/JulietaUla/Montserrat)
synbols-fruktur, Fruktur, OFL, Viktoriya Grabowska, Copyright (c) 2013  Sorkin Type Co (www.sorkintype.com eben@eyebytes.com) with Reserved Font Name 'Fruktur'
synbols-play, Play Regular, OFL, Jonas Hecksher, Copyright (c) 2011  Jonas Hecksher  Playtypes  e-types AS (lasse@e-types.com)  with Reserved Font Name 'Play'  'Playtype'  'Playtype Sans'.
synbols-play, Play Bold, OFL, Jonas Hecksher, Copyright (c) 2011  Jonas Hecksher  Playtypes  e-types AS (lasse@e-types.com)  with Reserved Font Name 'Play'  'Playtype'  'Playtype Sans'.
synbols-manjarithin, Manjari Thin, OFL, Santhosh Thottingal, Copyright 2018 The Manjari Project Authors (https://gitlab.com/smc/fonts/manjari)
synbols-manjari, Manjari Regular, OFL, Santhosh Thottingal, Copyright 2018 The Manjari Project Authors (https://gitlab.com/smc/fonts/manjari)
synbols-manjari, Manjari Bold, OFL, Santhosh Thottingal, Copyright 2018 The Manjari Project Authors (https://gitlab.com/smc/fonts/manjari)
synbols-capriola, Capriola Regular, OFL, Viktoriya Grabowska, Copyright (c) 2012  Sorkin Type Co (www.sorkintype.com eben@eyebytes.com) with Reserved Font Name Capriola.
synbols-grenzethin, Grenze Thin, OFL, Omnibus-Type, Copyright 2018 The Grenze Project Authors (https://github.com/Omnibus-Type/Grenze)  with Reserved Font Name Grenze.
synbols-grenzethin, Grenze Thin Italic, OFL, Omnibus-Type, Copyright 2018 The Grenze Project Authors (https://github.com/Omnibus-Type/Grenze)  with Reserved Font Name Grenze.
synbols-grenzeextralight, Grenze ExtraLight, OFL, Omnibus-Type, Copyright 2018 The Grenze Project Authors (https://github.com/Omnibus-Type/Grenze)  with Reserved Font Name Grenze.
synbols-grenzeextralight, Grenze ExtraLight Italic, OFL, Omnibus-Type, Copyright 2018 The Grenze Project Authors (https://github.com/Omnibus-Type/Grenze)  with Reserved Font Name Grenze.
synbols-grenzelight, Grenze Light, OFL, Omnibus-Type, Copyright 2018 The Grenze Project Authors (https://github.com/Omnibus-Type/Grenze)  with Reserved Font Name Grenze.
synbols-grenzelight, Grenze Light Italic, OFL, Omnibus-Type, Copyright 2018 The Grenze Project Authors (https://github.com/Omnibus-Type/Grenze)  with Reserved Font Name Grenze.
synbols-grenze, Grenze Regular, OFL, Omnibus-Type, Copyright 2018 The Grenze Project Authors (https://github.com/Omnibus-Type/Grenze)  with Reserved Font Name Grenze.
synbols-grenze, Grenze Italic, OFL, Omnibus-Type, Copyright 2018 The Grenze Project Authors (https://github.com/Omnibus-Type/Grenze)  with Reserved Font Name Grenze.
synbols-grenzemedium, Grenze Medium, OFL, Omnibus-Type, Copyright 2018 The Grenze Project Authors (https://github.com/Omnibus-Type/Grenze)  with Reserved Font Name Grenze.
synbols-grenzemedium, Grenze Medium Italic, OFL, Omnibus-Type, Copyright 2018 The Grenze Project Authors (https://github.com/Omnibus-Type/Grenze)  with Reserved Font Name Grenze.
synbols-grenzesemibold, Grenze SemiBold, OFL, Omnibus-Type, Copyright 2018 The Grenze Project Authors (https://github.com/Omnibus-Type/Grenze)  with Reserved Font Name Grenze.
synbols-grenzesemibold, Grenze SemiBold Italic, OFL, Omnibus-Type, Copyright 2018 The Grenze Project Authors (https://github.com/Omnibus-Type/Grenze)  with Reserved Font Name Grenze.
synbols-grenze, Grenze Bold, OFL, Omnibus-Type, Copyright 2018 The Grenze Project Authors (https://github.com/Omnibus-Type/Grenze)  with Reserved Font Name Grenze.
synbols-grenze, Grenze Bold Italic, OFL, Omnibus-Type, Copyright 2018 The Grenze Project Authors (https://github.com/Omnibus-Type/Grenze)  with Reserved Font Name Grenze.
synbols-grenzeextrabold, Grenze ExtraBold, OFL, Omnibus-Type, Copyright 2018 The Grenze Project Authors (https://github.com/Omnibus-Type/Grenze)  with Reserved Font Name Grenze.
synbols-grenzeextrabold, Grenze ExtraBold Italic, OFL, Omnibus-Type, Copyright 2018 The Grenze Project Authors (https://github.com/Omnibus-Type/Grenze)  with Reserved Font Name Grenze.
synbols-grenzeblack, Grenze Black, OFL, Omnibus-Type, Copyright 2018 The Grenze Project Authors (https://github.com/Omnibus-Type/Grenze)  with Reserved Font Name Grenze.
synbols-grenzeblack, Grenze Black Italic, OFL, Omnibus-Type, Copyright 2018 The Grenze Project Authors (https://github.com/Omnibus-Type/Grenze)  with Reserved Font Name Grenze.
synbols-brunoacesc, Bruno Ace SC, OFL, Astigmatic, Copyright (c) 2012 by Brian J. Bonislawsky DBA Astigmatic (AOETI) (astigma@astigmatic.com)  with Reserved Font Name Bruno Ace SC
synbols-electrolize, Electrolize, OFL, Gaslight, Copyright (c) 2011  Cyreal (www.cyreal.org a@cyreal.org) with Reserved Font Name Electrolize This Font Software is licensed under the SIL Open Font License  Version 1.1. This license is available with a FAQ at: http://scripts.sil.org/OFL
synbols-redhatdisplay, Red Hat Display, OFL, MCKL, Copyright 2019 The Red Hat Project Authors (https://github.com/RedHatOfficial/RedHatFont)
synbols-redhatdisplay, Red Hat Display It, OFL, MCKL, Copyright 2019 The Red Hat Project Authors (https://github.com/RedHatOfficial/RedHatFont)
synbols-redhatdisplaymedium, Red Hat Display Medium, OFL, MCKL, Copyright 2019 The Red Hat Project Authors (https://github.com/RedHatOfficial/RedHatFont)
synbols-redhatdisplaymedium, Red Hat Display Medium It, OFL, MCKL, Copyright 2019 The Red Hat Project Authors (https://github.com/RedHatOfficial/RedHatFont)
synbols-redhatdisplay, Red Hat Display Bold, OFL, MCKL, Copyright 2019 The Red Hat Project Authors (https://github.com/RedHatOfficial/RedHatFont)
