synbols-glegoo, Glegoo Bold, OFL, Eduardo Tunni, Copyright (c) 2011  Eduardo Tunni (http://www.tipo.net.ar)  Copyright 2011-13 Lohit Fonts Project contributors (http://fedorahosted.org/lohit)
synbols-portlligatsans, Port Lligat Sans, OFL, Tipo, Copyright (c) 2011  Tipo (http://www.tipo.net.ar dario@tipo.net.ar)  with Reserved Font Name Port Lligat Sans
synbols-aguafinascript, Aguafina Script Regular, OFL, Sudtipos, Copyright (c) 2007 Angel Koziupa (sudtipos@sudtipos.com)  Copyright (c) 2007 Alejandro Paul (sudtipos@sudtipos.com)  with Reserved Font Name Aguafina Script
synbols-sail, Sail, OFL, Miguel Hernandez, Copyright (c) 2011 by LatinoType Limitada (luciano@latinotype.com)  with Reserved Font Names Sail
synbols-engagement, Engagement, OFL, Astigmatic, Copyright (c) 2011 by Brian J. Bonislawsky DBA Astigmatic (AOETI) (astigma@astigmatic.com)  with Reserved Font Name Engagement
synbols-spinnaker, Spinnaker, OFL, Elena Albertoni, Copyright (c) 2011  Sorkin Type Co (www.sorkintype.com eben@eyebytes.com) with Reserved Font Name Spinnaker.
synbols-gloriahallelujah, Gloria Hallelujah, OFL, Kimberly Geswein, Copyright (c) 2010  Kimberly Geswein (kimberlygeswein.com kimberlygeswein@gmail.com)
synbols-marckscript, Marck Script, OFL, Denis Masharov, Copyright (c) 2011  Denis Masharov <denis.masharov@gmail.com>  Marck Fogel  with Reserved Font Names Marck Script.
synbols-cormorantunicaselight, Cormorant Unicase Light, OFL, Christian Thalmann, Copyright 2015 The Cormorant Project Authors (github.com/CatharsisFonts/Cormorant)
synbols-cormorantunicase, Cormorant Unicase Regular, OFL, Christian Thalmann, Copyright 2015 The Cormorant Project Authors (github.com/CatharsisFonts/Cormorant)
synbols-cormorantunicasemedium, Cormorant Unicase Medium, OFL, Christian Thalmann, Copyright 2015 The Cormorant Project Authors (github.com/CatharsisFonts/Cormorant)
synbols-cormorantunicasesemibold, Cormorant Unicase SemiBold, OFL, Christian Thalmann, Copyright 2015 The Cormorant Project Authors (github.com/CatharsisFonts/Cormorant)
synbols-cormorantunicase, Cormorant Unicase Bold, OFL, Christian Thalmann, Copyright 2015 The Cormorant Project Authors (github.com/CatharsisFonts/Cormorant)
synbols-orienta, Orienta, OFL, Eduardo Tunni, Copyright (c) 2012  Eduardo Tunni (http://www.tipo.net.ar edu@tipo.net.ar)  with Reserved Font Name 'Orienta'
synbols-homenaje, Homenaje Regular, OFL, Multiple Designers, Copyright 2016 The Homenaje Project Authors (https://github.com/googlefonts/Homenaje)  with Reserved Font Name 'Homenaje.
synbols-mrdehaviland, Mr De Haviland Regular, OFL, Sudtipos, Copyright (c) 2006 Alejandro Paul (sudtipos@sudtipos.com)  with Reserved Font Name Mr De Haviland
synbols-voces, Voces Regular, OFL, Multiple Designers, Copyright 2012 The Voces Project Authors (https://github.com/googlefonts/VocesFont)  with Reserved Font Names Voces  Voceso Pro  Voces UGR
synbols-novascript, Nova Script Regular, OFL, Wojciech Kalinowski, Copyright (c) 2011  wmk69 (wmk69@o2.pl) with Reserved Font Names 'NovaScript' and 'Nova Script'
synbols-piedra, Piedra Regular, OFL, Sudtipos, Copyright (c) 2011 Angel Koziupa (sudtipos@sudtipos.com)  Copyright (c) 2011 Alejandro Paul (sudtipos@sudtipos.com)  with Reserved Font Name Piedra
synbols-forum, Forum, OFL, Denis Masharov, Copyright (c) 2011  Denis Masharov <denis.masharov@gmail.com>. This Font Software is licensed under the SIL Open Font License  Version 1.1. This license is available with a FAQ at: http://scripts.sil.org/OFL
synbols-enriqueta, Enriqueta Regular, OFL, FontFuror, Copyright 2018 The Enriqueta Project Authors (https://github.com/vv-monsalve/Enriqueta_2019)
synbols-enriquetamedium, Enriqueta Medium, OFL, FontFuror, Copyright 2018 The Enriqueta Project Authors (https://github.com/vv-monsalve/Enriqueta_2019)
synbols-enriquetasemibold, Enriqueta SemiBold, OFL, FontFuror, Copyright 2018 The Enriqueta Project Authors (https://github.com/vv-monsalve/Enriqueta_2019)
synbols-enriqueta, Enriqueta Bold, OFL, FontFuror, Copyright 2018 The Enriqueta Project Authors (https://github.com/vv-monsalve/Enriqueta_2019)
synbols-eaglelake, Eagle Lake, OFL, Astigmatic, Copyright (c) 2012 by Brian J. Bonislawsky DBA Astigmatic (AOETI) (astigma@astigmatic.com)  with Reserved Font Name Eagle Lake
synbols-revalia, Revalia-Regular, OFL, Multiple Designers, Copyright (c) 2011  Johan Kallas (johankallas@gmail.com)  Copyright (c) 2011  Mihkel Virkus (mihkelvirkus@gmail.com)  with Reserved Font Name Revalia.
synbols-lilyscriptone, Lily Script One, OFL, Julia Petretta, Copyright (c) 2012-2013  Julia Petretta (www.juliapetretta.com julia.petretta@googlemail.com)  with Reserved Font Name 'Lily'
synbols-questrial, Questrial, OFL, Joe Prince, Copyright (c) 2011  Admix Designs (http://www.admixdesigns.com joe@admixdesigns.com) with Reserved Font Name Questrial.
synbols-baloothambi2, Baloo Thambi 2 Regular, OFL, Ek Type, Copyright 2019 The Baloo 2 Project Authors (https://github.com/EkType/Baloo2)
synbols-baloothambi2medium, Baloo Thambi 2 Medium, OFL, Ek Type, Copyright 2019 The Baloo 2 Project Authors (https://github.com/EkType/Baloo2)
synbols-baloothambi2semibold, Baloo Thambi 2 SemiBold, OFL, Ek Type, Copyright 2019 The Baloo 2 Project Authors (https://github.com/EkType/Baloo2)
synbols-baloothambi2, Baloo Thambi 2 Bold, OFL, Ek Type, Copyright 2019 The Baloo 2 Project Authors (https://github.com/EkType/Baloo2)
synbols-baloothambi2extrabold, Baloo Thambi 2 ExtraBold, OFL, Ek Type, Copyright 2019 The Baloo 2 Project Authors (https://github.com/EkType/Baloo2)
synbols-loveyalikeasister, Love Ya Like A Sister Regular, OFL, Kimberly Geswein, Copyright (c) 2011 by Kimberly Geswein (kimberlygeswein@gmail.com). All rights reserved.
synbols-merriweathersanslight, Merriweather Sans Light, OFL, Sorkin Type, Copyright (c) 2013-2016  Sorkin Type Co (www.sorkintype.com) with Reserved Font Name 'Merriweather'
synbols-merriweathersanslight, Merriweather Sans Light Italic, OFL, Sorkin Type, Copyright (c) 2013-2016  Sorkin Type Co (www.sorkintype.com) with Reserved Font Name 'Merriweather'
synbols-merriweathersans, Merriweather Sans, OFL, Sorkin Type, Copyright (c) 2013-2016  Sorkin Type Co (www.sorkintype.com) with Reserved Font Name 'Merriweather'
synbols-merriweathersans, Merriweather Sans Italic, OFL, Sorkin Type, Copyright (c) 2013-2016  Sorkin Type Co (www.sorkintype.com) with Reserved Font Name 'Merriweather'
synbols-merriweathersans, Merriweather Sans Bold, OFL, Sorkin Type, Copyright (c) 2013-2016  Sorkin Type Co (www.sorkintype.com) with Reserved Font Name 'Merriweather'
synbols-merriweathersans, Merriweather Sans Bold Italic, OFL, Sorkin Type, Copyright (c) 2013-2016  Sorkin Type Co (www.sorkintype.com) with Reserved Font Name 'Merriweather'
synbols-merriweathersansextrabold, Merriweather Sans ExtraBold, OFL, Sorkin Type, Copyright (c) 2013-2016  Sorkin Type Co (www.sorkintype.com) with Reserved Font Name 'Merriweather'
synbols-merriweathersansextrabold, Merriweather Sans ExtraBold Italic, OFL, Sorkin Type, Copyright (c) 2013-2016  Sorkin Type Co (www.sorkintype.com) with Reserved Font Name 'Merriweather'
synbols-kavoon, Kavoon, OFL, Viktoriya Grabowska, Copyright (c) 2011-2012  Sorkin Type Co (www.sorkintype.com) with Reserved Font Name 'Kavoon'
synbols-risque, Risque, OFL, Astigmatic, Copyright (c) 2012 by Brian J. Bonislawsky DBA Astigmatic (AOETI) (astigma@astigmatic.com)  with Reserved Font Name Risque
synbols-shortstack, Short Stack, OFL, James Grieshaber, Copyright (c) 2011  Sorkin Type Co (www.sorkintype.com eben@eyebytes.com) with Reserved Font Names Short Stack and Short Stack One.
synbols-muktamalarextralight, Mukta Malar ExtraLight, OFL, Ek Type, Copyright (c) 2016  Ek Type. All rights reserved.
synbols-muktamalarlight, Mukta Malar Light, OFL, Ek Type, Copyright (c) 2016  Ek Type. All rights reserved.
synbols-muktamalar, Mukta Malar Regular, OFL, Ek Type, Copyright (c) 2016  Ek Type. All rights reserved.
synbols-muktamalarmedium, Mukta Malar Medium, OFL, Ek Type, Copyright (c) 2016  Ek Type. All rights reserved.
synbols-muktamalarsemibold, Mukta Malar SemiBold, OFL, Ek Type, Copyright (c) 2016  Ek Type. All rights reserved.
synbols-muktamalar, Mukta Malar Bold, OFL, Ek Type, Copyright (c) 2016  Ek Type. All rights reserved.
synbols-muktamalarextrabold, Mukta Malar ExtraBold, OFL, Ek Type, Copyright (c) 2016  Ek Type. All rights reserved.
synbols-karmalight, Karma Light, OFL, Indian Type Foundry, Copyright 2014 Indian Type Foundry. All rights reserved.
synbols-karma, Karma Regular, OFL, Indian Type Foundry, Copyright 2014 Indian Type Foundry. All rights reserved.
synbols-karmamedium, Karma Medium, OFL, Indian Type Foundry, Copyright 2014 Indian Type Foundry. All rights reserved.
synbols-karmasemibold, Karma SemiBold, OFL, Indian Type Foundry, Copyright 2014 Indian Type Foundry. All rights reserved.
synbols-karma, Karma Bold, OFL, Indian Type Foundry, Copyright 2014 Indian Type Foundry. All rights reserved.
synbols-bonbon, Bonbon Regular, OFL, Cyreal, Copyright (c) 2011  Cyreal (www.cyreal.org) with Reserved Font Name Bonbon.  This Font Software is licensed under the SIL Open Font License  Version 1.1. This license is available with a FAQ at: http://scripts.sil.org/OFL
synbols-arimamaduraithin, Arima Madurai Thin, OFL, Multiple Designers, Copyright 2015 The Arima Project Authors (info@ndiscovered.com)
synbols-arimamaduraiextralight, Arima Madurai ExtraLight, OFL, Multiple Designers, Copyright 2015 The Arima Project Authors (info@ndiscovered.com)
synbols-arimamadurailight, Arima Madurai Light, OFL, Multiple Designers, Copyright 2015 The Arima Project Authors (info@ndiscovered.com)
synbols-arimamadurai, Arima Madurai Regular, OFL, Multiple Designers, Copyright 2015 The Arima Project Authors (info@ndiscovered.com)
synbols-arimamaduraimedium, Arima Madurai Medium, OFL, Multiple Designers, Copyright 2015 The Arima Project Authors (info@ndiscovered.com)
synbols-arimamadurai, Arima Madurai Bold, OFL, Multiple Designers, Copyright 2015 The Arima Project Authors (info@ndiscovered.com)
synbols-arimamaduraiextrabold, Arima Madurai ExtraBold, OFL, Multiple Designers, Copyright 2015 The Arima Project Authors (info@ndiscovered.com)
synbols-arimamaduraiblack, Arima Madurai Black, OFL, Multiple Designers, Copyright 2015 The Arima Project Authors (info@ndiscovered.com)
synbols-vibes, Vibes Regular, OFL, AbdElmomen Kadhim (blueMix), Copyright 2019 The Vibes Project Authors (https://github.com/bluemix/vibes-typeface)
synbols-encodesanssemiexpandedthin, Encode Sans Semi Expanded Thin, OFL, Impallari Type  Andres Torresi  Jacques Le Bailly, Copyright 2012 The Encode Project Authors (impallari@gmail.com)  with Reserved Font Name Encode Sans.
synbols-encodesanssemiexpandedexlight, Encode Sans Semi Expanded ExtraLight, OFL, Impallari Type  Andres Torresi  Jacques Le Bailly, Copyright 2012 The Encode Project Authors (impallari@gmail.com)  with Reserved Font Name Encode Sans.
synbols-encodesanssemiexpandedlight, Encode Sans Semi Expanded Light, OFL, Impallari Type  Andres Torresi  Jacques Le Bailly, Copyright 2012 The Encode Project Authors (impallari@gmail.com)  with Reserved Font Name Encode Sans.
synbols-encodesanssemiexpanded, Encode Sans Semi Expanded Regular, OFL, Impallari Type  Andres Torresi  Jacques Le Bailly, Copyright 2012 The Encode Project Authors (impallari@gmail.com)  with Reserved Font Name Encode Sans.
synbols-encodesanssemiexpandedmedium, Encode Sans Semi Expanded Medium, OFL, Impallari Type  Andres Torresi  Jacques Le Bailly, Copyright 2012 The Encode Project Authors (impallari@gmail.com)  with Reserved Font Name Encode Sans.
synbols-encodesanssemiexpandedsmbd, Encode Sans Semi Expanded SemiBold, OFL, Impallari Type  Andres Torresi  Jacques Le Bailly, Copyright 2012 The Encode Project Authors (impallari@gmail.com)  with Reserved Font Name Encode Sans.
synbols-encodesanssemiexpanded, Encode Sans Semi Expanded Bold, OFL, Impallari Type  Andres Torresi  Jacques Le Bailly, Copyright 2012 The Encode Project Authors (impallari@gmail.com)  with Reserved Font Name Encode Sans.
synbols-encodesanssemiexpandedexbd, Encode Sans Semi Expanded ExtraBold, OFL, Impallari Type  Andres Torresi  Jacques Le Bailly, Copyright 2012 The Encode Project Authors (impallari@gmail.com)  with Reserved Font Name Encode Sans.
synbols-encodesanssemiexpandedblack, Encode Sans Semi Expanded Black, OFL, Impallari Type  Andres Torresi  Jacques Le Bailly, Copyright 2012 The Encode Project Authors (impallari@gmail.com)  with Reserved Font Name Encode Sans.
synbols-meiescript, Meie Script, OFL, Multiple Designers, Copyright (c) 2011  2012 Johan Kallas (johankallas@gmail.com)  Mihkel Virkus (mihkelvirkus@gmail.com)  with Reserved Font Name 'Meie Script'
synbols-khulalight, Khula Light, OFL, Erin McLaughlin, Copyright (c) 2014  Erin McLaughlin (hello@erinmclaughlin.com). Digitized data copyright 2010  Google Corporation.
synbols-khula, Khula Regular, OFL, Erin McLaughlin, Copyright (c) 2014  Erin McLaughlin (hello@erinmclaughlin.com). Digitized data copyright 2010  Google Corporation.
synbols-khulasemibold, Khula SemiBold, OFL, Erin McLaughlin, Copyright (c) 2014  Erin McLaughlin (hello@erinmclaughlin.com). Digitized data copyright 2010  Google Corporation.
synbols-khula, Khula Bold, OFL, Erin McLaughlin, Copyright (c) 2014  Erin McLaughlin (hello@erinmclaughlin.com). Digitized data copyright 2010  Google Corporation.
synbols-khulaextrabold, Khula ExtraBold, OFL, Erin McLaughlin, Copyright (c) 2014  Erin McLaughlin (hello@erinmclaughlin.com). Digitized data copyright 2010  Google Corporation.
synbols-changaextralight, Changa ExtraLight, OFL, Eduardo Tunni, Copyright 2011 The Changa Project Authors (https://github.com/etunni/Changa)
synbols-ibmplexserifthin, IBM Plex Serif Thin, OFL, Mike Abbink  Bold Monday, Copyright 2018 IBM Corp. All rights reserved.
synbols-ibmplexserifthin, IBM Plex Serif Thin Italic, OFL, Mike Abbink  Bold Monday, Copyright 2018 IBM Corp. All rights reserved.
synbols-ibmplexserifextralight, IBM Plex Serif ExtraLight, OFL, Mike Abbink  Bold Monday, Copyright 2018 IBM Corp. All rights reserved.
synbols-ibmplexserifextralight, IBM Plex Serif ExtraLight Italic, OFL, Mike Abbink  Bold Monday, Copyright 2018 IBM Corp. All rights reserved.
synbols-ibmplexseriflight, IBM Plex Serif Light, OFL, Mike Abbink  Bold Monday, Copyright 2018 IBM Corp. All rights reserved.
synbols-ibmplexseriflight, IBM Plex Serif Light Italic, OFL, Mike Abbink  Bold Monday, Copyright 2018 IBM Corp. All rights reserved.
synbols-ibmplexserif, IBM Plex Serif, OFL, Mike Abbink  Bold Monday, Copyright 2018 IBM Corp. All rights reserved.
synbols-ibmplexserif, IBM Plex Serif Italic, OFL, Mike Abbink  Bold Monday, Copyright 2018 IBM Corp. All rights reserved.
synbols-ibmplexserifmedium, IBM Plex Serif Medium, OFL, Mike Abbink  Bold Monday, Copyright 2018 IBM Corp. All rights reserved.
synbols-ibmplexserifmedium, IBM Plex Serif Medium Italic, OFL, Mike Abbink  Bold Monday, Copyright 2018 IBM Corp. All rights reserved.
synbols-ibmplexserifsemibold, IBM Plex Serif SemiBold, OFL, Mike Abbink  Bold Monday, Copyright 2018 IBM Corp. All rights reserved.
synbols-ibmplexserifsemibold, IBM Plex Serif SemiBold Italic, OFL, Mike Abbink  Bold Monday, Copyright 2018 IBM Corp. All rights reserved.
synbols-ibmplexserif, IBM Plex Serif Bold, OFL, Mike Abbink  Bold Monday, Copyright 2018 IBM Corp. All rights reserved.
synbols-ibmplexserif, IBM Plex Serif Bold Italic, OFL, Mike Abbink  Bold Monday, Copyright 2018 IBM Corp. All rights reserved.
synbols-happymonkey, Happy Monkey, OFL, Brenda Gallo, Copyright (c) 2011 by Brenda Gallo (gbrenda1987@gmail.com)  with Reserved Font Name Happy Monkey.
synbols-alike, Alike Regular, OFL, Cyreal, Copyright (c) 2011  Cyreal (www.cyreal.org) with Reserved Font Name 'Alike'.
synbols-michroma, Michroma, OFL, Vernon Adams, Copyright (c) 2011  vernon adams (vern@newtypography.co.uk)  with Reserved Font Names 'Michroma'
synbols-bungeeinline, Bungee Inline Regular, OFL, David Jonathan Ross, Copyright 2008 The Bungee Project Authors (david@djr.com)
synbols-inter, Inter-Regular, OFL, Rasmus Andersson, Copyright 2020 The Inter Project Authors (https://github.com/rsms/inter)
synbols-unicaone, Unica One, OFL, Eduardo Tunni, Copyright (c) 2012  Eduardo Tunni (http://www.tipo.net.ar edu@tipo.net.ar)  with Reserved Font Name 'Unica'
synbols-abrilfatface, Abril Fatface, OFL, TypeTogether, Copyright (c) 2011  Copyright (c) 2011  TypeTogether (www.type-together.com info@type-together.com)  with Reserved Font Names Abril and Abril Fatface
synbols-felipa, Felipa, OFL, Fontstage, Copyright (c) 2011 Fontstage (info@fontstage.com)  with Reserved Font Name Felipa
synbols-angkor, Angkor Regular, OFL, Danh Hong, Copyright (c) 2010  Danh Hong (khmertype.blogspot.com)  with Reserved Font Name Angkor. This Font Software is licensed under the SIL Open Font License  Version 1.1. This license is available with a FAQ at: http://scripts.sil.org/OFL
synbols-nunitoextralight, Nunito ExtraLight, OFL, Vernon Adams, Copyright 2014 The Nunito Project Authors (https://github.com/googlefonts/NunitoFont)
synbols-nunitoextralight, Nunito ExtraLight Italic, OFL, Vernon Adams, Copyright 2014 The Nunito Project Authors (https://github.com/googlefonts/NunitoFont)
synbols-nunitolight, Nunito Light, OFL, Vernon Adams, Copyright 2014 The Nunito Project Authors (https://github.com/googlefonts/NunitoFont)
synbols-nunitolight, Nunito Light Italic, OFL, Vernon Adams, Copyright 2014 The Nunito Project Authors (https://github.com/googlefonts/NunitoFont)
synbols-nunito, Nunito Regular, OFL, Vernon Adams, Copyright 2014 The Nunito Project Authors (https://github.com/googlefonts/NunitoFont)
synbols-nunito, Nunito Italic, OFL, Vernon Adams, Copyright 2014 The Nunito Project Authors (https://github.com/googlefonts/NunitoFont)
synbols-nunitosemibold, Nunito SemiBold, OFL, Vernon Adams, Copyright 2014 The Nunito Project Authors (https://github.com/googlefonts/NunitoFont)
synbols-nunitosemibold, Nunito SemiBold Italic, OFL, Vernon Adams, Copyright 2014 The Nunito Project Authors (https://github.com/googlefonts/NunitoFont)
synbols-nunito, Nunito Bold, OFL, Vernon Adams, Copyright 2014 The Nunito Project Authors (https://github.com/googlefonts/NunitoFont)
synbols-nunito, Nunito Bold Italic, OFL, Vernon Adams, Copyright 2014 The Nunito Project Authors (https://github.com/googlefonts/NunitoFont)
synbols-nunitoextrabold, Nunito ExtraBold, OFL, Vernon Adams, Copyright 2014 The Nunito Project Authors (https://github.com/googlefonts/NunitoFont)
synbols-nunitoextrabold, Nunito ExtraBold Italic, OFL, Vernon Adams, Copyright 2014 The Nunito Project Authors (https://github.com/googlefonts/NunitoFont)
synbols-nunitoblack, Nunito Black, OFL, Vernon Adams, Copyright 2014 The Nunito Project Authors (https://github.com/googlefonts/NunitoFont)
synbols-nunitoblack, Nunito Black Italic, OFL, Vernon Adams, Copyright 2014 The Nunito Project Authors (https://github.com/googlefonts/NunitoFont)
synbols-lacquer, Lacquer Regular, OFL, Niki Polyocan  Eli Block, Copyright 2019 The Lacquer Project Authors (https://github.com/Lacquer-Font/Lacquer)
synbols-cherrybomb, Cherry Bomb Regular, OFL, Satsuyako, Copyright 2019 The Cherry Bomb Project Authors (https://github.com/satsuyako/CherryBomb)
synbols-andika, Andika Regular, OFL, SIL International, Copyright (c) 2004-2011  SIL International (http://www.sil.org/). Licensed under the SIL Open Font License  Version 1.1 (http://scripts.sil.org/OFL)  with Reserved Font Names Andika and SIL.
synbols-deliusunicase, Delius Unicase, OFL, Natalia Raices, Copyright (c) 2010  2011  Natalia Raices<nraices@gmail.com>  with Reserved Font Name Delius Delius Unicase Delius Swash Caps.
synbols-deliusunicase, Delius Unicase Bold, OFL, Natalia Raices, Copyright (c) 2010  2011  Natalia Raices<nraices@gmail.com>  with Reserved Font Name Delius Delius Unicase Delius Swash Caps.
synbols-asar, Asar Regular, OFL, Sorkin Type, Copyright (c) 2014-2015  Sorkin Type Co (sorkintype.com | sorkintype@gmail.com). Copyright 2014 Pria Ravichandran (pria.ravichandran@gmail.com)
synbols-modernantiqua, Modern Antiqua Regular, OFL, Wojciech Kalinowski, Copyright (c) 2011  wmk69  (wmk69@o2.pl)  with Reserved Font Names 'ModernAntiqua' and 'Modern Antiqua'. This Font Software is licensed under the SIL Open Font License  Version 1.1. This license is available with a FAQ at: http://scripts.sil.org/OFL
synbols-b612mono, B612 Mono Regular, OFL, Nicolas Chauveau  Thomas Paillot  Jonathan Favre-Lamarine  Jean-Luc Vinot, Copyright 2012 The B612 Project Authors (https://github.com/polarsys/b612)
synbols-b612mono, B612 Mono Italic, OFL, Nicolas Chauveau  Thomas Paillot  Jonathan Favre-Lamarine  Jean-Luc Vinot, Copyright 2012 The B612 Project Authors (https://github.com/polarsys/b612)
synbols-b612mono, B612 Mono Bold, OFL, Nicolas Chauveau  Thomas Paillot  Jonathan Favre-Lamarine  Jean-Luc Vinot, Copyright 2012 The B612 Project Authors (https://github.com/polarsys/b612)
synbols-b612mono, B612 Mono Bold Italic, OFL, Nicolas Chauveau  Thomas Paillot  Jonathan Favre-Lamarine  Jean-Luc Vinot, Copyright 2012 The B612 Project Authors (https://github.com/polarsys/b612)
synbols-missfajardose, Miss Fajardose Regular, OFL, Sudtipos, Copyright (c) 2004 Alejandro Paul (sudtipos@sudtipos.com)  with Reserved Font Name MissFajardose
synbols-nats, NATS, OFL, Purushoth Kumar Guttula, Copyright (c) 2012 Silicon Andhra (fonts.siliconandhra.org). Copyright (c) 2011-2012  Julieta Ulanovsky (julieta.ulanovsky@gmail.com)  with Reserved Font Names 'Montserrat'
synbols-bethellen, Beth Ellen Regular, OFL, Rob Jelinski, Copyright 2019 The Beth Ellen Project Authors (https://github.com/googlefonts/BethEllen)
synbols-sancreek, Sancreek Regular, OFL, Vernon Adams, Copyright (c) 2011 by vernon adams (vern@newtypography.co.uk)  with Reserved Font Names Sancreek
synbols-ewert, Ewert, OFL, Multiple Designers, Copyright (c) 2011  Johan Kallas (johankallas@gmail.com)  Copyright (c) 2011 Mihkel Virkus (mihkelvirkus@gmail.com) with Reserved Font Name Ewert.
synbols-chango, Chango Regular, OFL, Fontstage, Copyright (c) 2011 Fontstage (info@fontstage.com)  with Reserved Font Name Chango
synbols-oswald, Oswald Regular, OFL, Vernon Adams  Kalapi Gajjar  Cyreal, Copyright 2016 The Oswald Project Authors (https://github.com/googlefonts/OswaldFont)
synbols-gorditas, Gorditas, OFL, Gustavo Dipre, Copyright (c) 2011  Gustavo Dipre (gbrenda1987@gmail.com)  with Reserved Font Name Gorditas.
synbols-gorditas, Gorditas Bold, OFL, Gustavo Dipre, Copyright (c) 2011  Gustavo Dipre (gbrenda1987@gmail.com)  with Reserved Font Name Gorditas.
synbols-neutonextralight, Neuton ExtraLight, OFL, Brian Zick, Copyright 2010 The Neuton Project Authors (http://www.21326.info/)  with Reserved Font Name Neuton.
synbols-neutonlight, Neuton Light, OFL, Brian Zick, Copyright 2010 The Neuton Project Authors (http://www.21326.info/)  with Reserved Font Name Neuton.
synbols-neuton, Neuton Regular, OFL, Brian Zick, Copyright 2010 The Neuton Project Authors (http://www.21326.info/)  with Reserved Font Name Neuton.
synbols-neuton, Neuton Italic, OFL, Brian Zick, Copyright 2010 The Neuton Project Authors (http://www.21326.info/)  with Reserved Font Name Neuton.
synbols-neuton, Neuton Bold, OFL, Brian Zick, Copyright 2010 The Neuton Project Authors (http://www.21326.info/)  with Reserved Font Name Neuton.
synbols-neutonextrabold, Neuton ExtraBold, OFL, Brian Zick, Copyright 2010 The Neuton Project Authors (http://www.21326.info/)  with Reserved Font Name Neuton.
synbols-mavenpro, Maven Pro Regular, OFL, Joe Prince, Copyright 2011 The Maven Pro Project Authors (http://www.vissol.co.uk/mavenpro/)  with Reserved Font Name Maven Pro.
synbols-alegreyasc, Alegreya SC Regular, OFL, Huerta Tipogrfica, Copyright 2011 The Alegreya Project Authors (https://github.com/huertatipografica/Alegreya)
synbols-alegreyasc, Alegreya SC Italic, OFL, Huerta Tipogrfica, Copyright 2011 The Alegreya Project Authors (https://github.com/huertatipografica/Alegreya)
synbols-alegreyascmedium, Alegreya SC Medium, OFL, Huerta Tipogrfica, Copyright 2011 The Alegreya Project Authors (https://github.com/huertatipografica/Alegreya)
synbols-alegreyascmedium, Alegreya SC Medium Italic, OFL, Huerta Tipogrfica, Copyright 2011 The Alegreya Project Authors (https://github.com/huertatipografica/Alegreya)
synbols-alegreyasc, Alegreya SC Bold, OFL, Huerta Tipogrfica, Copyright 2011 The Alegreya Project Authors (https://github.com/huertatipografica/Alegreya)
synbols-alegreyasc, Alegreya SC Bold Italic, OFL, Huerta Tipogrfica, Copyright 2011 The Alegreya Project Authors (https://github.com/huertatipografica/Alegreya)
synbols-alegreyascextrabold, Alegreya SC ExtraBold, OFL, Huerta Tipogrfica, Copyright 2011 The Alegreya Project Authors (https://github.com/huertatipografica/Alegreya)
synbols-alegreyascextrabold, Alegreya SC ExtraBold Italic, OFL, Huerta Tipogrfica, Copyright 2011 The Alegreya Project Authors (https://github.com/huertatipografica/Alegreya)
synbols-alegreyascblack, Alegreya SC Black, OFL, Huerta Tipogrfica, Copyright 2011 The Alegreya Project Authors (https://github.com/huertatipografica/Alegreya)
synbols-alegreyascblack, Alegreya SC Black Italic, OFL, Huerta Tipogrfica, Copyright 2011 The Alegreya Project Authors (https://github.com/huertatipografica/Alegreya)
synbols-lekton, Lekton, OFL, Multiple Designers, Copyright (c) 2008  2009  2010  Accademia di Belle Arti di Urbino (luciano.perondi@isiaurbino.net). Licensed under the SIL Open Font License  Version 1.1
synbols-lekton, Lekton-Italic, OFL, Multiple Designers, Copyright (c) 2008  2009  2010  Accademia di Belle Arti di Urbino (luciano.perondi@isiaurbino.net). Licensed under the SIL Open Font License  Version 1.1
