synbols-concertone, Concert One, OFL, Multiple Designers, Copyright (c) 2011  2011 Johan Kallas (johankallas@gmail.com)  Copyright (c) 2011  2011 Mihkel Virkus (mihkelvirkus@gmail.com)  with Reserved Font Name Concert.
synbols-terminaldosis, Terminal Dosis Light, OFL, multiple designers, Copyright (c) 2011 by Edgar Tolentino  Pablo Impallari  Igino Marini (impallari.com impallari@gmail.com). All rights reserved.
synbols-padauk, Padauk Regular, OFL, SIL International, Copyright SIL International  all rights reserved
synbols-padauk, Padauk Bold, OFL, SIL International, Copyright SIL International  all rights reserved
synbols-rosariolight, Rosario Light, OFL, Omnibus-Type, Copyright 2019 The Rosario Project Authors (https://github.com/Omnibus-Type/Rosario)
synbols-rosariolight, Rosario Light Italic, OFL, Omnibus-Type, Copyright 2019 The Rosario Project Authors (https://github.com/Omnibus-Type/Rosario)
synbols-hammersmithone, Hammersmith One, OFL, Nicole Fally, Copyright (c) 2011  Sorkin Type Co. (www.sorkintype.com eben@eyebytes.com) with Reserved Font Name Hammersmith One. This Font Software is licensed under the SIL Open Font License  Version 1.1. This license is available with a FAQ at: http://scripts.sil.org/OFL
synbols-khandlight, Khand Light, OFL, Indian Type Foundry, Copyright (c) 2014 Indian Type Foundry (info@indiantypefoundry.com)
synbols-khand, Khand Regular, OFL, Indian Type Foundry, Copyright (c) 2014 Indian Type Foundry (info@indiantypefoundry.com)
synbols-khandmedium, Khand Medium, OFL, Indian Type Foundry, Copyright (c) 2014 Indian Type Foundry (info@indiantypefoundry.com)
synbols-khandsemibold, Khand SemiBold, OFL, Indian Type Foundry, Copyright (c) 2014 Indian Type Foundry (info@indiantypefoundry.com)
synbols-khand, Khand Bold, OFL, Indian Type Foundry, Copyright (c) 2014 Indian Type Foundry (info@indiantypefoundry.com)
synbols-baijamjureeextralight, Bai Jamjuree ExtraLight, OFL, Cadson Demak, Copyright 2018 Bai Jamjuree (https://github.com/cadsondemak/Bai-Jamjuree)
synbols-baijamjureeextralight, Bai Jamjuree ExtraLight Italic, OFL, Cadson Demak, Copyright 2018 Bai Jamjuree (https://github.com/cadsondemak/Bai-Jamjuree)
synbols-baijamjureelight, Bai Jamjuree Light, OFL, Cadson Demak, Copyright 2018 Bai Jamjuree (https://github.com/cadsondemak/Bai-Jamjuree)
synbols-baijamjureelight, Bai Jamjuree Light Italic, OFL, Cadson Demak, Copyright 2018 Bai Jamjuree (https://github.com/cadsondemak/Bai-Jamjuree)
synbols-baijamjuree, Bai Jamjuree Regular, OFL, Cadson Demak, Copyright 2018 Bai Jamjuree (https://github.com/cadsondemak/Bai-Jamjuree)
synbols-baijamjuree, Bai Jamjuree Italic, OFL, Cadson Demak, Copyright 2018 Bai Jamjuree (https://github.com/cadsondemak/Bai-Jamjuree)
synbols-baijamjureemedium, Bai Jamjuree Medium, OFL, Cadson Demak, Copyright 2018 Bai Jamjuree (https://github.com/cadsondemak/Bai-Jamjuree)
synbols-baijamjureemedium, Bai Jamjuree Medium Italic, OFL, Cadson Demak, Copyright 2018 Bai Jamjuree (https://github.com/cadsondemak/Bai-Jamjuree)
synbols-baijamjureesemibold, Bai Jamjuree SemiBold, OFL, Cadson Demak, Copyright 2018 Bai Jamjuree (https://github.com/cadsondemak/Bai-Jamjuree)
synbols-baijamjureesemibold, Bai Jamjuree SemiBold Italic, OFL, Cadson Demak, Copyright 2018 Bai Jamjuree (https://github.com/cadsondemak/Bai-Jamjuree)
synbols-baijamjuree, Bai Jamjuree Bold, OFL, Cadson Demak, Copyright 2018 Bai Jamjuree (https://github.com/cadsondemak/Bai-Jamjuree)
synbols-baijamjuree, Bai Jamjuree Bold Italic, OFL, Cadson Demak, Copyright 2018 Bai Jamjuree (https://github.com/cadsondemak/Bai-Jamjuree)
synbols-underdog, Underdog, OFL, Multiple Designers, Copyright (c) 2012  Sergey Steblina (sergey@steblina.com)  Jovanny Lemonad (lemonad@jovanny.ru)  with Reserved Font Name 'Underdog'
synbols-dmsans, DM Sans Regular, OFL, Colophon Foundry  Jonny Pinhorn, Copyright 2014-2017 Indian Type Foundry (info@indiantypefoundry.com) with Reserved Font Name 'Poppins'. Copyright 2019 Google LLC.
synbols-dmsans, DM Sans Italic, OFL, Colophon Foundry  Jonny Pinhorn, Copyright 2014-2017 Indian Type Foundry (info@indiantypefoundry.com) with Reserved Font Name 'Poppins'. Copyright 2019 Google LLC.
synbols-dmsansmedium, DM Sans Medium, OFL, Colophon Foundry  Jonny Pinhorn, Copyright 2014-2017 Indian Type Foundry (info@indiantypefoundry.com) with Reserved Font Name 'Poppins'. Copyright 2019 Google LLC.
synbols-dmsansmedium, DM Sans Medium Italic, OFL, Colophon Foundry  Jonny Pinhorn, Copyright 2014-2017 Indian Type Foundry (info@indiantypefoundry.com) with Reserved Font Name 'Poppins'. Copyright 2019 Google LLC.
synbols-dmsans, DM Sans Bold, OFL, Colophon Foundry  Jonny Pinhorn, Copyright 2014-2017 Indian Type Foundry (info@indiantypefoundry.com) with Reserved Font Name 'Poppins'. Copyright 2019 Google LLC.
synbols-dmsans, DM Sans Bold Italic, OFL, Colophon Foundry  Jonny Pinhorn, Copyright 2014-2017 Indian Type Foundry (info@indiantypefoundry.com) with Reserved Font Name 'Poppins'. Copyright 2019 Google LLC.
synbols-almarailight, Almarai Light, OFL, Boutros Fonts, Copyright (c) 2019 by Almarai. All rights reserved.
synbols-almarai, Almarai, OFL, Boutros Fonts, Copyright (c) 2019 by Almarai. All rights reserved.
synbols-almaraibold, Almarai Bold, OFL, Boutros Fonts, Copyright (c) 2019 by Almarai. All rights reserved.
synbols-almaraiextrabold, Almarai ExtraBold, OFL, Boutros Fonts, Copyright (c) 2019 by Almarai. All rights reserved.
synbols-coveredbyyourgrace, Covered By Your Grace, OFL, Kimberly Geswein, Copyright (c) 2010  Kimberly Geswein (kimberlygeswein.com kimberlygeswein@gmail.com)
synbols-scada, Scada Regular, OFL, Jovanny Lemonad, Copyright 2012 The Scada Project Authors (lemonad@jovanny.ru)
synbols-scada, Scada Italic, OFL, Jovanny Lemonad, Copyright 2012 The Scada Project Authors (lemonad@jovanny.ru)
synbols-scada, Scada Bold, OFL, Jovanny Lemonad, Copyright 2012 The Scada Project Authors (lemonad@jovanny.ru)
synbols-scada, Scada Bold Italic, OFL, Jovanny Lemonad, Copyright 2012 The Scada Project Authors (lemonad@jovanny.ru)
synbols-oxaniumextralight, Oxanium ExtraLight, OFL, Severin Meyer, Copyright 2019 The Oxanium Project Authors (https://github.com/sevmeyer/oxanium)
synbols-oxaniumlight, Oxanium Light, OFL, Severin Meyer, Copyright 2019 The Oxanium Project Authors (https://github.com/sevmeyer/oxanium)
synbols-oxanium, Oxanium Regular, OFL, Severin Meyer, Copyright 2019 The Oxanium Project Authors (https://github.com/sevmeyer/oxanium)
synbols-oxaniummedium, Oxanium Medium, OFL, Severin Meyer, Copyright 2019 The Oxanium Project Authors (https://github.com/sevmeyer/oxanium)
synbols-oxaniumsemibold, Oxanium SemiBold, OFL, Severin Meyer, Copyright 2019 The Oxanium Project Authors (https://github.com/sevmeyer/oxanium)
synbols-oxanium, Oxanium Bold, OFL, Severin Meyer, Copyright 2019 The Oxanium Project Authors (https://github.com/sevmeyer/oxanium)
synbols-oxaniumextrabold, Oxanium ExtraBold, OFL, Severin Meyer, Copyright 2019 The Oxanium Project Authors (https://github.com/sevmeyer/oxanium)
synbols-baloobhaina2, Baloo Bhaina 2 Regular, OFL, Ek Type, Copyright 2019 The Baloo 2 Project Authors (https://github.com/EkType/Baloo2)
synbols-baloobhaina2medium, Baloo Bhaina 2 Medium, OFL, Ek Type, Copyright 2019 The Baloo 2 Project Authors (https://github.com/EkType/Baloo2)
synbols-baloobhaina2semibold, Baloo Bhaina 2 SemiBold, OFL, Ek Type, Copyright 2019 The Baloo 2 Project Authors (https://github.com/EkType/Baloo2)
synbols-baloobhaina2, Baloo Bhaina 2 Bold, OFL, Ek Type, Copyright 2019 The Baloo 2 Project Authors (https://github.com/EkType/Baloo2)
synbols-baloobhaina2extrabold, Baloo Bhaina 2 ExtraBold, OFL, Ek Type, Copyright 2019 The Baloo 2 Project Authors (https://github.com/EkType/Baloo2)
synbols-ibmplexsanscondensedthin, IBM Plex Sans Condensed Thin, OFL, Mike Abbink  Bold Monday, Copyright 2018 IBM Corp. All rights reserved.
synbols-ibmplexsanscondensedthin, IBM Plex Sans Condensed Thin Italic, OFL, Mike Abbink  Bold Monday, Copyright 2018 IBM Corp. All rights reserved.
synbols-ibmplexsanscondensedextralight, IBM Plex Sans Condensed ExtraLight, OFL, Mike Abbink  Bold Monday, Copyright 2018 IBM Corp. All rights reserved.
synbols-ibmplexsanscondensedextralight, IBM Plex Sans Condensed ExtraLight Italic, OFL, Mike Abbink  Bold Monday, Copyright 2018 IBM Corp. All rights reserved.
synbols-ibmplexsanscondensedlight, IBM Plex Sans Condensed Light, OFL, Mike Abbink  Bold Monday, Copyright 2018 IBM Corp. All rights reserved.
synbols-ibmplexsanscondensedlight, IBM Plex Sans Condensed Light Italic, OFL, Mike Abbink  Bold Monday, Copyright 2018 IBM Corp. All rights reserved.
synbols-ibmplexsanscondensed, IBM Plex Sans Condensed, OFL, Mike Abbink  Bold Monday, Copyright 2018 IBM Corp. All rights reserved.
synbols-ibmplexsanscondensed, IBM Plex Sans Condensed Italic, OFL, Mike Abbink  Bold Monday, Copyright 2018 IBM Corp. All rights reserved.
synbols-ibmplexsanscondensedmedium, IBM Plex Sans Condensed Medium, OFL, Mike Abbink  Bold Monday, Copyright 2018 IBM Corp. All rights reserved.
synbols-ibmplexsanscondensedmedium, IBM Plex Sans Condensed Medium Italic, OFL, Mike Abbink  Bold Monday, Copyright 2018 IBM Corp. All rights reserved.
synbols-ibmplexsanscondensedsemibold, IBM Plex Sans Condensed SemiBold, OFL, Mike Abbink  Bold Monday, Copyright 2018 IBM Corp. All rights reserved.
synbols-ibmplexsanscondensedsemibold, IBM Plex Sans Condensed SemiBold Italic, OFL, Mike Abbink  Bold Monday, Copyright 2018 IBM Corp. All rights reserved.
synbols-ibmplexsanscondensed, IBM Plex Sans Condensed Bold, OFL, Mike Abbink  Bold Monday, Copyright 2018 IBM Corp. All rights reserved.
synbols-ibmplexsanscondensed, IBM Plex Sans Condensed Bold Italic, OFL, Mike Abbink  Bold Monday, Copyright 2018 IBM Corp. All rights reserved.
synbols-nothingyoucoulddo, Nothing You Could Do, OFL, Kimberly Geswein, Copyright (c) 2010  Kimberly Geswein (kimberlygeswein.com kimberlygeswein@gmail.com). This Font Software is licensed under the SIL Open Font License  Version 1.1. This license available with a FAQ at: http://scripts.sil.org/OFL
synbols-bhavuka, Bhavuka Regular, OFL, Multiple Designers, Copyright 2014 - Matt Heximer (www.10fourdesign.com)
based on Latin Bellota by Kemie Guaida (www.pixilate.com)  
which is in turn based on Snippet by Gesine Todt.

Licensed under the SIL Open Font License 1.1 This license is available with a FAQ at: http://scripts.sil.org/OFL
(see file OFL.txt)
synbols-uncialantiqua, Uncial Antiqua, OFL, Astigmatic, Copyright (c) 2011 by Brian J. Bonislawsky DBA Astigmatic (AOETI) (astigma@astigmatic.com)  with Reserved Font Name Uncial Antiqua
synbols-rubikmonoone, Rubik Mono One Regular, OFL, Hubert and Fischer, Copyright 2015 The Rubik Project Authors (mail@hubertfischer.com)
synbols-adamina, Adamina Regular, OFL, Cyreal, Copyright (c) 2011  Cyreal (www.cyreal.org) with Reserved Font Name 'Adamina'
synbols-lalezar, Lalezar Regular, OFL, Borna Izadpanah, Copyright 2015 The Lalezar Project Authors (https://github.com/BornaIz/Lalezar)
synbols-geostarfill, Geostar Fill, OFL, Joe Prince, Copyright (c) 2011  Admix Designs (http://www.admixdesigns.com joe@admixdesigns.com) with Reserved Font Name Geostar.
synbols-pragatinarrow, Pragati Narrow, OFL, Omnibus-Type, Copyright (c) 2012-2015  Omnibus-Type (www.omnibus-type.com omnibus.type@gmail.com)
synbols-pragatinarrow, Pragati Narrow Bold, OFL, Omnibus-Type, Copyright (c) 2012-2015  Omnibus-Type (www.omnibus-type.com omnibus.type@gmail.com)
synbols-orbitron, Orbitron Regular, OFL, Matt McInerney, Copyright 2018 The Orbitron Project Authors (https://github.com/theleagueof/orbitron)
synbols-fingerpaint, Finger Paint Regular, OFL, Carrois Apostrophe, Copyright (c) 2011 by Ralph du Carrois  with Reserved Font Name 'Finger Paint'
synbols-nobile, Nobile, OFL, Vernon Adams, Copyright (c) 2010 by vernon adams (vern@newtypography.co.uk) with Reserved Font Name 'Nobile'. All rights reserved.
synbols-nobile, Nobile Italic, OFL, Vernon Adams, Copyright (c) 2010 by vernon adams (vern@newtypography.co.uk) with Reserved Font Name 'Nobile'. All rights reserved.
synbols-nobilemedium, Nobile Medium, OFL, Vernon Adams, Copyright (c) 2010 by vernon adams (vern@newtypography.co.uk) with Reserved Font Name 'Nobile'. All rights reserved.
synbols-nobilemedium, Nobile Medium Italic, OFL, Vernon Adams, Copyright (c) 2010 by vernon adams (vern@newtypography.co.uk) with Reserved Font Name 'Nobile'. All rights reserved.
synbols-nobile, Nobile Bold, OFL, Vernon Adams, Copyright (c) 2010 by vernon adams (vern@newtypography.co.uk) with Reserved Font Name 'Nobile'. All rights reserved.
synbols-nobile, Nobile Bold Italic, OFL, Vernon Adams, Copyright (c) 2010 by vernon adams (vern@newtypography.co.uk) with Reserved Font Name 'Nobile'. All rights reserved.
synbols-arbutusslab, Arbutus Slab Regular, OFL, Karolina Lach, Copyright (c) 2012 by Sorkin Type Co.. All rights reserved.
synbols-librebarcode128text, Libre Barcode 128 Text Regular, OFL, Lasse Fister, Copyright 2017 The Libre Barcode Project Authors (lasse@graphicore.de)
synbols-slabo27px, Slabo 27px, OFL, John Hudson, Copyright (c) 2013  Tiro Typeworks Ltd (www.tiro.com).
synbols-strong, Strong, OFL, Gaslight, Copyright (c) 2011  Cyreal (www.cyreal.org a@cyreal.org) with Reserved Font Name Strong. This Font Software is licensed under the SIL Open Font License  Version 1.1. This license is available with a FAQ at: http://scripts.sil.org/OFL
synbols-harmattan, Harmattan Regular, OFL, SIL International, Copyright (c) 2007-2008  The C&MA Guinea Fulbe Team;

Copyright renewed 2011-2012  George W. Nuss (http://www.fulbefouta.com) 
with the Reserved Font Name Fouta.

Copyright (c) 2004-2015  SIL International (http://scripts.sil.org)  
with Reserved Font Names 'Andika' and 'SIL'.

Copyright (c) 2014-2015  SIL International (http://www.sil.org/).
with Reserved Font Names Harmattan and SIL.
synbols-lobster, Lobster Regular, OFL, Impallari Type, Copyright 2010 The Lobster Project Authors (https://github.com/impallari/The-Lobster-Font)  with Reserved Font Name Lobster.
synbols-spicyrice, Spicy Rice, OFL, Astigmatic, Copyright (c) 2011 by Brian J. Bonislawsky DBA Astigmatic (AOETI) (astigma@astigmatic.com)  with Reserved Font Name Spicy Rice
synbols-volkhov, Volkhov Regular, OFL, Cyreal, Copyright (c) 2011  Cyreal (www.cyreal.org a@cyreal.org) with Reserved Font Name Volkhov and Volkhov Regular. This Font Software is licensed under the SIL Open Font License  Version 1.1. This license is available with a FAQ at: http://scripts.sil.org/OFL
synbols-volkhov, Volkhov Italic, OFL, Cyreal, Copyright (c) 2011  Cyreal (www.cyreal.org a@cyreal.org) with Reserved Font Name Volkhov and Volkhov Italic. This Font Software is licensed under the SIL Open Font License  Version 1.1. This license is available with a FAQ at: http://scripts.sil.org/OFL
synbols-volkhov, Volkhov Bold, OFL, Cyreal, Copyright (c) 2011  Cyreal (www.cyreal.org a@cyreal.org) with Reserved Font Name Volkhov and Volkhov Bold. This Font Software is licensed under the SIL Open Font License  Version 1.1. This license is available with a FAQ at: http://scripts.sil.org/OFL
synbols-volkhov, Volkhov Bold Italic, OFL, Cyreal, Copyright (c) 2011  Cyreal (www.cyreal.org a@cyreal.org) with Reserved Font Name Volkhov and Volkhov Bold Italic. This Font Software is licensed under the SIL Open Font License  Version 1.1. This license is available with a FAQ at: http://scripts.sil.org/OFL
synbols-zillaslabhighlight, Zilla Slab Highlight, OFL, Typotheque, Copyright 2017  The Mozilla Foundation
synbols-zillaslabhighlight, Zilla Slab Highlight Bold, OFL, Typotheque, Copyright 2017  The Mozilla Foundation
synbols-halantlight, Halant Light, OFL, Indian Type Foundry, Copyright (c) 2014 Indian Type Foundry (info@indiantypefoundry.com)
synbols-halant, Halant Regular, OFL, Indian Type Foundry, Copyright (c) 2014 Indian Type Foundry (info@indiantypefoundry.com)
synbols-halantmedium, Halant Medium, OFL, Indian Type Foundry, Copyright (c) 2014 Indian Type Foundry (info@indiantypefoundry.com)
synbols-halantsemibold, Halant SemiBold, OFL, Indian Type Foundry, Copyright (c) 2014 Indian Type Foundry (info@indiantypefoundry.com)
synbols-halant, Halant Bold, OFL, Indian Type Foundry, Copyright (c) 2014 Indian Type Foundry (info@indiantypefoundry.com)
synbols-cambay, Cambay Regular, OFL, Pooja Saxena, Copyright (c) 2014 Pooja Saxena (www.poojasaxena.in)
synbols-cambay, Cambay Italic, OFL, Pooja Saxena, Copyright (c) 2014 Pooja Saxena (www.poojasaxena.in)
synbols-cambay, Cambay Bold, OFL, Pooja Saxena, Copyright (c) 2014 Pooja Saxena (www.poojasaxena.in)
synbols-cambay, Cambay Bold Italic, OFL, Pooja Saxena, Copyright (c) 2014 Pooja Saxena (www.poojasaxena.in)
synbols-gildadisplay, Gilda Display, OFL, Eduardo Tunni, Copyright (c) 2012  Eduardo Tunni (http://www.tipo.net.ar edu@tipo.net.ar)  with Reserved Font Name 'Gilda'
synbols-croissantone, Croissant One, OFL, Eduardo Tunni, Copyright (c) 2012  Eduardo Tunni (http://www.tipo.net.ar edu@tipo.net.ar)  with Reserved Font Name 'Croissant'
synbols-overpassthin, Overpass Thin, OFL, Delve Withrington, Copyright  2016 by Red Hat  Inc. All rights reserved.
synbols-overpassthin, Overpass Thin Italic, OFL, Delve Withrington, Copyright (c) 2016 by Red Hat  Inc. All rights reserved.
synbols-overpassextralight, Overpass ExtraLight, OFL, Delve Withrington, Copyright  2016 by Red Hat  Inc. All rights reserved.
synbols-overpassextralight, Overpass ExtraLight Italic, OFL, Delve Withrington, Copyright (c) 2016 by Red Hat  Inc. All rights reserved.
synbols-overpasslight, Overpass Light, OFL, Delve Withrington, Copyright  2016 by Red Hat  Inc. All rights reserved.
synbols-overpasslight, Overpass Light Italic, OFL, Delve Withrington, Copyright (c) 2016 by Red Hat  Inc. All rights reserved.
synbols-overpass, Overpass Regular, OFL, Delve Withrington, Copyright  2016 by Red Hat  Inc. All rights reserved.
synbols-overpass, Overpass Italic, OFL, Delve Withrington, Copyright (c) 2016 by Red Hat  Inc. All rights reserved.
synbols-overpasssemibold, Overpass SemiBold, OFL, Delve Withrington, Copyright  2016 by Red Hat  Inc. All rights reserved.
synbols-overpasssemibold, Overpass SemiBold Italic, OFL, Delve Withrington, Copyright (c) 2016 by Red Hat  Inc. All rights reserved.
synbols-overpass, Overpass Bold, OFL, Delve Withrington, Copyright  2016 by Red Hat  Inc. All rights reserved.
synbols-overpass, Overpass Bold Italic, OFL, Delve Withrington, Copyright (c) 2016 by Red Hat  Inc. All rights reserved.
synbols-overpassextrabold, Overpass ExtraBold, OFL, Delve Withrington, Copyright  2016 by Red Hat  Inc. All rights reserved.
synbols-overpassextrabold, Overpass ExtraBold Italic, OFL, Delve Withrington, Copyright (c) 2016 by Red Hat  Inc. All rights reserved.
synbols-overpassblack, Overpass Black, OFL, Delve Withrington, Copyright  2016 by Red Hat  Inc. All rights reserved.
synbols-overpassblack, Overpass Black Italic, OFL, Delve Withrington, Copyright (c) 2016 by Red Hat  Inc. All rights reserved.
synbols-graduate, Graduate, OFL, Eduardo Tunni, Copyright (c) 2012  Eduardo Tunni (http://www.tipo.net.ar edu@tipo.net.ar)  with Reserved Font Name Graduate
synbols-sairacondensedthin, Saira Condensed Thin, OFL, Omnibus-Type, Copyright 2016 The Saira Project Authors (omnibus.type@gmail.com)  with reserved font name Saira.
synbols-sairacondensedextralight, Saira Condensed ExtraLight, OFL, Omnibus-Type, Copyright 2016 The Saira Project Authors (omnibus.type@gmail.com)  with reserved font name Saira.
synbols-sairacondensedlight, Saira Condensed Light, OFL, Omnibus-Type, Copyright 2016 The Saira Project Authors (omnibus.type@gmail.com)  with reserved font name Saira.
synbols-sairacondensed, Saira Condensed Regular, OFL, Omnibus-Type, Copyright 2016 The Saira Project Authors (omnibus.type@gmail.com)  with reserved font name Saira.
synbols-sairacondensedmedium, Saira Condensed Medium, OFL, Omnibus-Type, Copyright 2016 The Saira Project Authors (omnibus.type@gmail.com)  with reserved font name Saira.
synbols-sairacondensedsemibold, Saira Condensed SemiBold, OFL, Omnibus-Type, Copyright 2016 The Saira Project Authors (omnibus.type@gmail.com)  with reserved font name Saira.
synbols-sairacondensedcondensed, Saira Condensed Bold, OFL, Omnibus-Type, Copyright 2016 The Saira Project Authors (omnibus.type@gmail.com)  with reserved font name Saira.
synbols-sairacondensedextrabold, Saira Condensed ExtraBold, OFL, Omnibus-Type, Copyright 2016 The Saira Project Authors (omnibus.type@gmail.com)  with reserved font name Saira.
synbols-sairacondensedblack, Saira Condensed Black, OFL, Omnibus-Type, Copyright 2016 The Saira Project Authors (omnibus.type@gmail.com)  with reserved font name Saira.
synbols-caveatbrush, Caveat Brush, OFL, Impallari Type, Copyright 2015 Google Inc. All Rights Reserved.
synbols-sansationlight, Sansation Light, OFL, Bernd Montag, Copyright (c) 2011 by Bernd Montag (berndmontag@gmx.de)  with Reserved Font Name 'Sansation'
synbols-sansationlight, Sansation Light Italic, OFL, Bernd Montag, Copyright (c) 2011 by Bernd Montag (berndmontag@gmx.de)  with Reserved Font Name 'Sansation'
synbols-sansation, Sansation Regular, OFL, Bernd Montag, Copyright (c) 2011 by Bernd Montag (berndmontag@gmx.de)  with Reserved Font Name 'Sansation'
synbols-sansation, Sansation Italic, OFL, Bernd Montag, Copyright (c) 2011 by Bernd Montag (berndmontag@gmx.de)  with Reserved Font Name 'Sansation'
synbols-sansation, Sansation Bold, OFL, Bernd Montag, Copyright (c) 2011 by Bernd Montag (berndmontag@gmx.de)  with Reserved Font Name 'Sansation'
synbols-sansation, Sansation Bold Italic, OFL, Bernd Montag, Copyright (c) 2011 by Bernd Montag (berndmontag@gmx.de)  with Reserved Font Name 'Sansation'
synbols-almendra, Almendra Regular, OFL, Ana Sanfelippo, Copyright (c) 2011-2012  Ana Sanfelippo (anasanfe@gmail.com)  with Reserved Font Name 'Almendra'
synbols-almendra, Almendra Italic, OFL, Ana Sanfelippo, Copyright (c) 2011-2012  Ana Sanfelippo (anasanfe@gmail.com)  with Reserved Font Name 'Almendra'
synbols-almendra, Almendra Bold, OFL, Ana Sanfelippo, Copyright (c) 2011-2012  Ana Sanfelippo (anasanfe@gmail.com)  with Reserved Font Name 'Almendra'
synbols-almendra, Almendra Bold Italic, OFL, Ana Sanfelippo, Copyright (c) 2011-2012  Ana Sanfelippo (anasanfe@gmail.com)  with Reserved Font Name 'Almendra'
synbols-kristi, Kristi Regular, OFL, Birgit Pulk, Copyright (c) 2010  Birgit Pulk (birgitpulk@gmail.com). All rights reserved. Licenced under SIL OFL v1.1
synbols-solwaylight, Solway Light, OFL, Mariya V. Pigoulevskaya  The Northern Block, Copyright 2018 The Solway Project Authors (https://github.com/mashavp/Solway)
synbols-solway, Solway Regular, OFL, Mariya V. Pigoulevskaya  The Northern Block, Copyright 2018 The Solway Project Authors (https://github.com/mashavp/Solway)
synbols-solwaymedium, Solway Medium, OFL, Mariya V. Pigoulevskaya  The Northern Block, Copyright 2018 The Solway Project Authors (https://github.com/mashavp/Solway)
synbols-solway, Solway Bold, OFL, Mariya V. Pigoulevskaya  The Northern Block, Copyright 2018 The Solway Project Authors (https://github.com/mashavp/Solway)
synbols-solwayextrabold, Solway ExtraBold, OFL, Mariya V. Pigoulevskaya  The Northern Block, Copyright 2018 The Solway Project Authors (https://github.com/mashavp/Solway)
synbols-librebarcode39extendedtext, Libre Barcode 39 Extended Text, OFL, Lasse Fister, Copyright 2017 The Libre Barcode Project Authors (lasse@graphicore.de)
synbols-publicsansthin, Public Sans Thin, OFL, Multiple Designers, Copyright (c) 2015  Pablo Impallari  Rodrigo Fuenzalida (Modified by Dan O. Williams and USWDS) (https://github.com/uswds/public-sans)
synbols-publicsansthin, Public Sans Thin Italic, OFL, Multiple Designers, Copyright (c) 2015  Pablo Impallari  Rodrigo Fuenzalida (Modified by Dan O. Williams and USWDS) (https://github.com/uswds/public-sans)
synbols-cardo, Cardo, OFL, David Perry, Copyright (c) 2002-2011  David J. Perry (hospes02@scholarsfonts.net)
synbols-cardo, Cardo Italic, OFL, David Perry, Copyright (c) 2002-2011  David J. Perry (hospes02@scholarsfonts.net)
synbols-cardo, Cardo Bold, OFL, David Perry, Copyright (c) 2002-2011  David J. Perry (hospes02@scholarsfonts.net)
synbols-keaniaone, Keania One, OFL, Julia Petretta, Copyright (c) 2012  Julia Petretta (julia.petretta@googlemail.com)  with Reserved Font Name 'Keania'
synbols-parisienne, Parisienne, OFL, Astigmatic, Copyright (c) 2012 by Brian J. Bonislawsky DBA Astigmatic (AOETI) (astigma@astigmatic.com)  with Reserved Font Name Parisienne
synbols-sedgwickavedisplay, Sedgwick Ave Display Regular, OFL, Multiple Designers, Copyright 2017 The Sedgwick Ave Project Authors (https://github.com/googlefonts/sedgwickave)
synbols-anton, Anton Regular, OFL, Vernon Adams, Copyright 2011 The Anton Project Authors
synbols-redhattext, Red Hat Text, OFL, MCKL, Copyright 2019 The Red Hat Project Authors (https://github.com/RedHatOfficial/RedHatFont)
synbols-redhattext, Red Hat Text It, OFL, MCKL, Copyright 2019 The Red Hat Project Authors (https://github.com/RedHatOfficial/RedHatFont)
synbols-redhattextmedium, Red Hat Text Medium, OFL, MCKL, Copyright 2019 The Red Hat Project Authors (https://github.com/RedHatOfficial/RedHatFont)
synbols-redhattextmedium, Red Hat Text Medium It, OFL, MCKL, Copyright 2019 The Red Hat Project Authors (https://github.com/RedHatOfficial/RedHatFont)
synbols-redhattext, Red Hat Text Bold, OFL, MCKL, Copyright 2019 The Red Hat Project Authors (https://github.com/RedHatOfficial/RedHatFont)
synbols-redhattext, Red Hat Text Bold It, OFL, MCKL, Copyright 2019 The Red Hat Project Authors (https://github.com/RedHatOfficial/RedHatFont)
synbols-archivoblack, Archivo Black Regular, OFL, Omnibus-Type, Copyright 2017 The Archivo Black Project Authors (https://github.com/Omnibus-Type/ArchivoBlack)
